{
  "version": 1,
  "grid": 5,
  "nextId": 14,
  "swatches": [
    {
      "id": "surface",
      "name": "Surface",
      "color": "#ffffff",
      "mode": "gray",
      "dark": {
        "mode": "custom",
        "color": "#202735",
        "colorMode": "gray"
      }
    },
    {
      "id": "ink",
      "name": "Text",
      "color": "#253047",
      "mode": "gray",
      "dark": {
        "mode": "custom",
        "color": "#e6eaf3",
        "colorMode": "gray"
      }
    },
    {
      "id": "border",
      "name": "Border",
      "color": "#cbd1de",
      "mode": "gray",
      "dark": {
        "mode": "custom",
        "color": "#536078",
        "colorMode": "gray"
      }
    },
    {
      "id": "accent",
      "name": "Button",
      "color": "#6746b7",
      "mode": "hsb",
      "dark": {
        "mode": "custom",
        "color": "#b9a1ff",
        "colorMode": "hsb"
      }
    },
    {
      "id": "muted",
      "name": "Muted text",
      "color": "#626d82",
      "mode": "gray",
      "dark": {
        "mode": "custom",
        "color": "#aeb9cb",
        "colorMode": "gray"
      }
    }
  ],
  "boxes": [
    {
      "id": 1,
      "x": 40,
      "y": 80,
      "w": 800,
      "h": 500,
      "text": "",
      "fill": "surface",
      "textColor": "ink",
      "borderColor": "border",
      "borderWidth": 1,
      "radius": 0,
      "paddingX": 5,
      "paddingY": 5,
      "alignX": "left",
      "alignY": "center",
      "fontFamily": "Assistant",
      "fontSize": 14,
      "fontWeight": 400,
      "fontStyle": "normal"
    },
    {
      "id": 2,
      "x": 40,
      "y": 80,
      "w": 800,
      "h": 50,
      "text": "Mailbox",
      "fill": "surface",
      "textColor": "ink",
      "borderColor": "border",
      "borderWidth": 1,
      "radius": 0,
      "paddingX": 55,
      "paddingY": 5,
      "alignX": "left",
      "alignY": "center",
      "fontFamily": "Assistant",
      "fontSize": 20,
      "fontWeight": 600,
      "fontStyle": "normal"
    },
    {
      "id": 3,
      "x": 40,
      "y": 130,
      "w": 160,
      "h": 450,
      "text": "",
      "fill": "surface",
      "textColor": "ink",
      "borderColor": "border",
      "borderWidth": 1,
      "radius": 0,
      "paddingX": 5,
      "paddingY": 5,
      "alignX": "left",
      "alignY": "center",
      "fontFamily": "Assistant",
      "fontSize": 14,
      "fontWeight": 400,
      "fontStyle": "normal"
    },
    {
      "id": 4,
      "x": 55,
      "y": 145,
      "w": 130,
      "h": 35,
      "text": "Compose",
      "fill": "accent",
      "textColor": "surface",
      "borderColor": null,
      "borderWidth": 1,
      "radius": 5,
      "paddingX": 35,
      "paddingY": 5,
      "alignX": "left",
      "alignY": "center",
      "fontFamily": "Assistant",
      "fontSize": 14,
      "fontWeight": 400,
      "fontStyle": "normal"
    },
    {
      "id": 5,
      "x": 55,
      "y": 195,
      "w": 130,
      "h": 30,
      "text": "Inbox",
      "fill": null,
      "textColor": "ink",
      "borderColor": null,
      "borderWidth": 1,
      "radius": 0,
      "paddingX": 35,
      "paddingY": 5,
      "alignX": "left",
      "alignY": "center",
      "fontFamily": "Assistant",
      "fontSize": 14,
      "fontWeight": 600,
      "fontStyle": "normal"
    },
    {
      "id": 6,
      "x": 215,
      "y": 145,
      "w": 610,
      "h": 75,
      "text": "Alex Morgan\nProject update",
      "fill": null,
      "textColor": "ink",
      "borderColor": "border",
      "borderWidth": 1,
      "radius": 0,
      "paddingX": 10,
      "paddingY": 5,
      "alignX": "left",
      "alignY": "center",
      "fontFamily": "Assistant",
      "fontSize": 14,
      "fontWeight": 400,
      "fontStyle": "normal"
    },
    {
      "id": 7,
      "x": 215,
      "y": 235,
      "w": 610,
      "h": 30,
      "text": "Today · 1 conversation",
      "fill": null,
      "textColor": "muted",
      "borderColor": null,
      "borderWidth": 1,
      "radius": 0,
      "paddingX": 5,
      "paddingY": 5,
      "alignX": "left",
      "alignY": "center",
      "fontFamily": "Assistant",
      "fontSize": 14,
      "fontWeight": 400,
      "fontStyle": "normal"
    },
    {
      "id": 8,
      "x": 215,
      "y": 280,
      "w": 610,
      "h": 280,
      "text": "Your next idea starts here.",
      "fill": null,
      "textColor": "ink",
      "borderColor": "border",
      "borderWidth": 1,
      "radius": 0,
      "paddingX": 15,
      "paddingY": 15,
      "alignX": "left",
      "alignY": "top",
      "fontFamily": "Assistant",
      "fontSize": 14,
      "fontWeight": 400,
      "fontStyle": "normal"
    },
    {
      "id": 9,
      "x": 55,
      "y": 90,
      "w": 30,
      "h": 30,
      "text": "mail",
      "fill": null,
      "textColor": "ink",
      "borderColor": null,
      "borderWidth": 1,
      "radius": 0,
      "paddingX": 0,
      "paddingY": 0,
      "alignX": "center",
      "alignY": "center",
      "fontFamily": "Material Symbols Outlined",
      "fontSize": 25,
      "fontWeight": 400,
      "fontStyle": "normal"
    },
    {
      "id": 10,
      "x": 60,
      "y": 150,
      "w": 25,
      "h": 25,
      "text": "edit",
      "fill": null,
      "textColor": "surface",
      "borderColor": null,
      "borderWidth": 1,
      "radius": 0,
      "paddingX": 0,
      "paddingY": 0,
      "alignX": "center",
      "alignY": "center",
      "fontFamily": "Material Symbols Outlined",
      "fontSize": 20,
      "fontWeight": 400,
      "fontStyle": "normal"
    },
    {
      "id": 11,
      "x": 60,
      "y": 200,
      "w": 20,
      "h": 20,
      "text": "inbox",
      "fill": null,
      "textColor": "ink",
      "borderColor": null,
      "borderWidth": 1,
      "radius": 0,
      "paddingX": 0,
      "paddingY": 0,
      "alignX": "center",
      "alignY": "center",
      "fontFamily": "Material Icons",
      "fontSize": 20,
      "fontWeight": 400,
      "fontStyle": "normal"
    },
    {
      "id": 12,
      "x": 570,
      "y": 90,
      "w": 250,
      "h": 30,
      "text": "Search mail",
      "fill": null,
      "textColor": "muted",
      "borderColor": "border",
      "borderWidth": 1,
      "radius": 5,
      "paddingX": 35,
      "paddingY": 5,
      "alignX": "left",
      "alignY": "center",
      "fontFamily": "Assistant",
      "fontSize": 14,
      "fontWeight": 400,
      "fontStyle": "normal"
    },
    {
      "id": 13,
      "x": 580,
      "y": 95,
      "w": 20,
      "h": 20,
      "text": "search",
      "fill": null,
      "textColor": "muted",
      "borderColor": null,
      "borderWidth": 1,
      "radius": 0,
      "paddingX": 0,
      "paddingY": 0,
      "alignX": "center",
      "alignY": "center",
      "fontFamily": "Material Symbols Outlined",
      "fontSize": 20,
      "fontWeight": 400,
      "fontStyle": "normal"
    }
  ],
  "lastStyle": {
    "fill": null,
    "textColor": "ink",
    "borderColor": null,
    "borderWidth": 1,
    "radius": 0,
    "paddingX": 5,
    "paddingY": 5,
    "alignX": "left",
    "alignY": "center",
    "fontFamily": "",
    "fontSize": 14,
    "fontWeight": 400,
    "fontStyle": "normal"
  },
  "canvasColors": {
    "background": "#f6f7fa",
    "gridMajor": "#d0d0d0",
    "gridMinor": "#e8e8e8"
  },
  "canvasColorModes": {
    "background": "gray",
    "gridMajor": "gray",
    "gridMinor": "gray"
  },
  "canvasDark": {
    "background": {
      "mode": "custom",
      "color": "#11151e",
      "colorMode": "gray"
    },
    "gridMajor": {
      "mode": "custom",
      "color": "#303b52",
      "colorMode": "gray"
    },
    "gridMinor": {
      "mode": "custom",
      "color": "#20293b",
      "colorMode": "gray"
    }
  }
}
